{
 "header": {
  "name": "EPI Scenario 1",
  "schema": "https://raw.githubusercontent.com/DARPA-ASKEM/Model-Representations/petrinet_v0.6/petrinet/petrinet_schema.json",
  "schema_name": "petrinet",
  "description": "EPI Scenario 1",
  "model_version": "0.1"
 },
 "properties": {},
 "model": {
  "states": [
   {
    "id": "S",
    "name": "S",
    "grounding": {
     "identifiers": {
      "ido": "0000514"
     },
     "modifiers": {}
    },
    "units": {
     "expression": "person",
     "expression_mathml": "<ci>person</ci>"
    }
   },
   {
    "id": "I_mild",
    "name": "I_mild",
    "grounding": {
     "identifiers": {
      "ido": "0000511"
     },
     "modifiers": {
      "status": "mild"
     }
    },
    "units": {
     "expression": "person",
     "expression_mathml": "<ci>person</ci>"
    }
   },
   {
    "id": "E",
    "name": "E",
    "grounding": {
     "identifiers": {
      "apollosv": "00000154"
     },
     "modifiers": {}
    },
    "units": {
     "expression": "person",
     "expression_mathml": "<ci>person</ci>"
    }
   },
   {
    "id": "I_case",
    "name": "I_case",
    "grounding": {
     "identifiers": {
      "ido": "0000511"
     },
     "modifiers": {
      "status": "case "
     }
    },
    "units": {
     "expression": "person",
     "expression_mathml": "<ci>person</ci>"
    }
   },
   {
    "id": "R",
    "name": "R",
    "grounding": {
     "identifiers": {
      "ido": "0000592"
     },
     "modifiers": {}
    },
    "units": {
     "expression": "person",
     "expression_mathml": "<ci>person</ci>"
    }
   },
   {
    "id": "D",
    "name": "D",
    "grounding": {
     "identifiers": {
      "ncit": "C28554"
     },
     "modifiers": {}
    },
    "units": {
     "expression": "person",
     "expression_mathml": "<ci>person</ci>"
    }
   }
  ],
  "transitions": [
   {
    "id": "t1",
    "input": [
     "I_mild",
     "S"
    ],
    "output": [
     "I_mild",
     "E"
    ],
    "properties": {
     "name": "t1"
    }
   },
   {
    "id": "t2",
    "input": [
     "I_case",
     "S"
    ],
    "output": [
     "I_case",
     "E"
    ],
    "properties": {
     "name": "t2"
    }
   },
   {
    "id": "t3",
    "input": [
     "E"
    ],
    "output": [
     "I_mild"
    ],
    "properties": {
     "name": "t3"
    }
   },
   {
    "id": "t4",
    "input": [
     "I_mild"
    ],
    "output": [
     "R"
    ],
    "properties": {
     "name": "t4"
    }
   },
   {
    "id": "t5",
    "input": [
     "E"
    ],
    "output": [
     "I_case"
    ],
    "properties": {
     "name": "t5"
    }
   },
   {
    "id": "t6",
    "input": [
     "I_case"
    ],
    "output": [
     "R"
    ],
    "properties": {
     "name": "t6"
    }
   },
   {
    "id": "t7",
    "input": [
     "I_case"
    ],
    "output": [
     "D"
    ],
    "properties": {
     "name": "t7"
    }
   }
  ]
 },
 "semantics": {
  "ode": {
   "rates": [
    {
     "target": "t1",
     "expression": "I_mild*S*r_SE_mild/N",
     "expression_mathml": "<apply><divide/><apply><times/><ci>I_mild</ci><ci>S</ci><ci>r_SE_mild</ci></apply><ci>N</ci></apply>"
    },
    {
     "target": "t2",
     "expression": "I_case*S*r_SE_case/N",
     "expression_mathml": "<apply><divide/><apply><times/><ci>I_case</ci><ci>S</ci><ci>r_SE_case</ci></apply><ci>N</ci></apply>"
    },
    {
     "target": "t3",
     "expression": "E*r_EI_mild/N",
     "expression_mathml": "<apply><divide/><apply><times/><ci>E</ci><ci>r_EI_mild</ci></apply><ci>N</ci></apply>"
    },
    {
     "target": "t4",
     "expression": "I_mild*r_I_mildR/N",
     "expression_mathml": "<apply><divide/><apply><times/><ci>I_mild</ci><ci>r_I_mildR</ci></apply><ci>N</ci></apply>"
    },
    {
     "target": "t5",
     "expression": "E*r_EI_case/N",
     "expression_mathml": "<apply><divide/><apply><times/><ci>E</ci><ci>r_EI_case</ci></apply><ci>N</ci></apply>"
    },
    {
     "target": "t6",
     "expression": "I_case*r_I_caseR/N",
     "expression_mathml": "<apply><divide/><apply><times/><ci>I_case</ci><ci>r_I_caseR</ci></apply><ci>N</ci></apply>"
    },
    {
     "target": "t7",
     "expression": "I_case*r_I_caseD/N",
     "expression_mathml": "<apply><divide/><apply><times/><ci>I_case</ci><ci>r_I_caseD</ci></apply><ci>N</ci></apply>"
    }
   ],
   "initials": [],
   "parameters": [
    {
     "id": "N",
     "value": 100.0,
     "units": {
      "expression": "person",
      "expression_mathml": "<ci>person</ci>"
     }
    },
    {
     "id": "r_SE_mild",
     "units": {
      "expression": "1/day",
      "expression_mathml": "<apply><power/><ci>day</ci><cn>-1</cn></apply>"
     }
    },
    {
     "id": "r_SE_case",
     "units": {
      "expression": "1/day",
      "expression_mathml": "<apply><power/><ci>day</ci><cn>-1</cn></apply>"
     }
    },
    {
     "id": "r_EI_mild",
     "units": {
      "expression": "1/day",
      "expression_mathml": "<apply><power/><ci>day</ci><cn>-1</cn></apply>"
     }
    },
    {
     "id": "r_I_mildR",
     "units": {
      "expression": "1/day",
      "expression_mathml": "<apply><power/><ci>day</ci><cn>-1</cn></apply>"
     }
    },
    {
     "id": "r_EI_case",
     "units": {
      "expression": "1/day",
      "expression_mathml": "<apply><power/><ci>day</ci><cn>-1</cn></apply>"
     }
    },
    {
     "id": "r_I_caseR",
     "units": {
      "expression": "1/day",
      "expression_mathml": "<apply><power/><ci>day</ci><cn>-1</cn></apply>"
     }
    },
    {
     "id": "r_I_caseD",
     "units": {
      "expression": "1/day",
      "expression_mathml": "<apply><power/><ci>day</ci><cn>-1</cn></apply>"
     }
    }
   ],
   "observables": [],
   "time": {
    "id": "t",
    "units": {
     "expression": "day",
     "expression_mathml": "<ci>day</ci>"
    }
   }
  }
 },
 "metadata": {
  "annotations": {
   "license": null,
   "authors": [],
   "references": [],
   "time_scale": null,
   "time_start": null,
   "time_end": null,
   "locations": [],
   "pathogens": [],
   "diseases": [],
   "hosts": [],
   "model_types": []
  }
 }
}